Sample_ID,Round,Role,Strategy,Sentence_Index,Mean_Entropy,Max_Entropy,Std_Entropy,Text_Content,Phase
persona_115_Turn2,2,Persuader,Personal Story,1,0.29869223782237564,1.018409604634173,0.40416503214632954,<reasoning>,Reasoning
persona_115_Turn2,2,Persuader,Personal Story,2,0.48763238864982084,1.2640406533445754,0.3962657199132629,"The conversation has just begun, with the persuadee expressing a positive mood and mentioning a recent activity related to pet food testing.",Reasoning
persona_115_Turn2,2,Persuader,Personal Story,3,0.6578806182425451,1.3975303366775569,0.4449574686798386,"This suggests a casual and friendly tone, which is a good opportunity to engage them in a meaningful way.",Reasoning
persona_115_Turn2,2,Persuader,Personal Story,4,0.6761032426227356,1.4964896050110958,0.5428919643164943,The persuadee might be open to a gentle and empathetic approach.,Reasoning
persona_115_Turn2,2,Persuader,Personal Story,5,0.6497514223078376,1.4256135439147433,0.4647566260889553,"Since the donatee is engaged and seems interested in making a positive impact, using a **Personal Story** can help create a relatable and emotionally compelling connection.",Reasoning
persona_115_Turn3,3,Persuader,Foot in the Door,1,0.25860468987780966,0.6931471805599453,0.28519398566634174,<reasoning>The persuadee expressed concern about the issue but is hesitant to commit to donating.,Reasoning
persona_115_Turn3,3,Persuader,Foot in the Door,2,0.32564126151426914,1.2883671783676327,0.37737218311609255,This hesitation may be due to uncertainty about the impact of small donations or a lack of personal connection to the cause.,Reasoning
persona_115_Turn3,3,Persuader,Foot in the Door,3,0.46276602871922445,1.3220248896056577,0.44553706535805676,"To overcome this, it's important to reinforce the credibility of the charity, highlight the tangible impact of small contributions, and potentially use a ""foot in the door"" strategy to encourage a small initial donation.",Reasoning
persona_115_Turn3,3,Persuader,Foot in the Door,4,0.5875945079818067,1.3163213281535127,0.5216209514562783,"By showing that even a small contribution can make a difference, we can build trust and encourage further engagement.",Reasoning
persona_115_Turn3,3,Persuader,Foot in the Door,5,0.5187574597783411,1.562569334086764,0.4897732068084943,"The persuadee may also need reassurance about the charity's effectiveness and transparency, so using a ""credibility appeal"" or ""source-related inquiry"" can help.",Reasoning
persona_115_Turn3,3,Persuader,Foot in the Door,6,0.5978440877803889,1.391641393602037,0.5373162904115487,"Additionally, linking the donation to a real-life impact through a personal story or emotional appeal could help bridge the gap between concern and action.",Reasoning
persona_115_Turn4,4,Persuader,Credibility Appeal,1,0.30207944418876076,0.847549913544488,0.37455238775606253,<reasoning>,Reasoning
persona_115_Turn4,4,Persuader,Credibility Appeal,2,0.28720311237560936,1.292075396159224,0.41411029118275444,The Persuadee has expressed a willingness to consider donating but is asking for more information about how the donations are used.,Reasoning
persona_115_Turn4,4,Persuader,Credibility Appeal,3,0.4566376933125802,1.3313116057474685,0.45445919197510304,This indicates they are looking for transparency and reassurance about the charity's credibility and effectiveness.,Reasoning
persona_115_Turn4,4,Persuader,Credibility Appeal,4,0.42540973707560714,1.4080311983924203,0.44867943574149294,The Persuadee may be hesitant due to a lack of trust or a desire to ensure their contribution is being used appropriately.,Reasoning
persona_115_Turn4,4,Persuader,Credibility Appeal,5,0.5436737231251612,1.3725256430695028,0.3995631790564893,"It's important to provide clear, concise, and trustworthy information to alleviate their concerns and build confidence.",Reasoning
persona_115_Turn5,5,Persuader,Source Related Inquiry,1,0.3946153464068113,1.3102294246347408,0.5248735733500723,<reasoning>,Reasoning
persona_115_Turn5,5,Persuader,Source Related Inquiry,2,0.3341711013636381,0.7689019410410227,0.2843187137982171,The persuadee is showing interest in the charity but is still hesitant to donate.,Reasoning
persona_115_Turn5,5,Persuader,Source Related Inquiry,3,0.32610050122285467,1.3558414316029685,0.38971191419648143,"They have asked for more information about how donations are used, which indicates they are looking for reassurance and transparency.",Reasoning
persona_115_Turn5,5,Persuader,Source Related Inquiry,4,0.4029541163779179,1.422408326295258,0.4843630885390041,"This is a common hesitation among potential donors, as they want to feel confident that their contribution will be used effectively.",Reasoning
persona_115_Turn5,5,Persuader,Source Related Inquiry,5,0.6073945464882368,1.4213697157183798,0.4920519850577039,"By acknowledging this need for more information, I can provide further reassurance and encourage them to take a small step towards donating.",Reasoning
persona_115_Turn6,6,Persuader,Donation Information,1,0.34251867589094886,1.4202401730463283,0.40115008683262504,"<reasoning> The persuadee has expressed interest in learning more about the specific programs and how funds are allocated, indicating a desire for transparency and detailed information.",Reasoning
persona_115_Turn6,6,Persuader,Donation Information,2,0.3848840304688518,1.4242335945684446,0.45427010761761605,This shows they are looking for reassurance and concrete examples of how their contribution will be used.,Reasoning
persona_115_Turn6,6,Persuader,Donation Information,3,0.4706224229733719,1.385706018948396,0.45883865768882,"The next logical step is to provide specific examples of programs or initiatives that the donations support, thereby reinforcing the credibility and impact of the donation.",Reasoning
persona_115_Turn6,6,Persuader,Donation Information,4,0.5117422859497104,1.4260411221427447,0.4962427174640508,"This approach aligns with the Credibility Appeal and Donation Information strategies, which aim to build trust and provide clarity on how contributions are utilized.",Reasoning
persona_115_Turn7,7,Persuader,Personal Story,1,0.42415245978428273,0.9184037436085521,0.3319189917225861,<reasoning>The persuadee is showing interest but still hesitating to donate.,Reasoning
persona_115_Turn7,7,Persuader,Personal Story,2,0.48802937016146153,1.1692356938221775,0.4141460432350533,"They want more specific information about the programs and how funds are allocated, which indicates a need for transparency and reassurance.",Reasoning
persona_115_Turn7,7,Persuader,Personal Story,3,0.7576065952096727,1.3902653283038078,0.4652367855844663,The persuasion should now focus on reinforcing trust and showing the direct impact of donations with more personal and emotional elements.,Reasoning
persona_115_Turn8,8,Persuader,Personal Related Inquiry,1,0.2949027303726459,0.789118368569997,0.3626668973228675,<reasoning>,Reasoning
persona_115_Turn8,8,Persuader,Personal Related Inquiry,2,0.45866634709195864,1.0396380924440898,0.3939258983998831,"The persuadee has expressed interest in the charity's mission and impact, but they have emphasized their current focus on helping animals through their work.",Reasoning
persona_115_Turn8,8,Persuader,Personal Related Inquiry,3,0.547754718358605,1.205294503873219,0.4621462756707703,"This indicates that while they are open to the idea of contributing to a cause, they may be prioritizing other commitments.",Reasoning
persona_115_Turn8,8,Persuader,Personal Related Inquiry,4,0.7304399314900443,1.3886032014989442,0.4645944943803946,They also seem to be looking for reassurance about the effectiveness and transparency of the charity.,Reasoning
persona_115_Turn8,8,Persuader,Personal Related Inquiry,5,0.570079290863285,1.4927042457861932,0.4538775408603387,"By highlighting the alignment between the charity's mission and the persuadee's values (helping animals), we can create a bridge that makes donating feel like a natural extension of their existing efforts.",Reasoning
persona_115_Turn9,9,Persuader,Personal Related Inquiry,1,0.46051448287383345,1.340359638215907,0.4280338866714217,<reasoning>The persuadee has expressed interest in understanding the impact of donations and the organization’s credibility but has ultimately chosen to focus on animal welfare instead of children’s needs.,Reasoning
persona_115_Turn9,9,Persuader,Personal Related Inquiry,2,0.6515153654661744,1.3304278572397847,0.41646595501083394,This indicates that they value their work with animals and may not see a direct connection between their efforts and children's needs.,Reasoning
persona_115_Turn9,9,Persuader,Personal Related Inquiry,3,0.6437409592403419,1.357572837994469,0.4555927450711369,"Therefore, to align with their priorities, it would be effective to suggest a way in which their support for animals and children can be combined.",Reasoning
persona_115_Turn9,9,Persuader,Personal Related Inquiry,4,0.5524622889757922,1.362075079745958,0.4576954540009508,This would respect their priorities while still encouraging them to consider contributing to the charity in a manner that aligns with their values.,Reasoning
persona_115_Turn10,10,Persuader,Task Related Inquiry,1,0.35047869131646087,1.3070199161066287,0.4144731137481385,<reasoning>The conversation has progressed to a point where the Persuadee is prioritizing animal welfare over children's needs.,Reasoning
persona_115_Turn10,10,Persuader,Task Related Inquiry,2,0.4844084249967994,1.4502867668602935,0.49720446816162517,The Persuadee has shown an interest in understanding the impact of donations but has opted to focus on their current work with animals.,Reasoning
persona_115_Turn10,10,Persuader,Task Related Inquiry,3,0.5987269074170514,1.3323154683464828,0.517106515798913,The Persuader must respect this choice while continuing to present the value of their cause.,Reasoning
persona_115_Turn10,10,Persuader,Task Related Inquiry,4,0.8385002451964527,1.4238365495593315,0.48053526430828014,A logical and empathetic approach is needed to reframe the message and perhaps offer a more aligned path without being pushy.,Reasoning
persona_72_Turn2,2,Persuader,Logical Appeal,1,0.4579150679787611,1.4253874631461447,0.42881422015542275,"<reasoning>The current conversation is in the early stages, with the Persuadee showing a peaceful and content demeanor.",Reasoning
persona_72_Turn2,2,Persuader,Logical Appeal,2,0.5890832112642517,1.265136405331908,0.43195827517434404,This is a good opportunity to transition into a Logical Appeal to establish the importance of the cause.,Reasoning
persona_72_Turn2,2,Persuader,Logical Appeal,3,0.38165019681869605,1.3964091937896277,0.4364877610650922,"The Persuadee seems open and receptive, making it an ideal time to introduce the charity's mission and the impact of small donations.",Reasoning
persona_72_Turn3,3,Persuader,Donation Information,1,0.20379908988514853,0.8853815502503775,0.2911030064734181,<reasoning>The persuadee has expressed interest in learning more about how donations are used by Save the Children.,Reasoning
persona_72_Turn3,3,Persuader,Donation Information,2,0.5797540776534157,1.395081055397314,0.4136788988970618,This is a crucial moment to build trust and credibility.,Reasoning
persona_72_Turn3,3,Persuader,Donation Information,3,0.42613139483223644,1.3173736647792413,0.4284865857830728,"By providing specific information about how donations are utilized, the Persuader can address the persuadee's curiosity and reinforce the value of their contribution.",Reasoning
persona_72_Turn3,3,Persuader,Donation Information,4,0.7325054619472217,1.425958696041217,0.44366655587320586,"This strategy helps to establish the charity’s effectiveness and transparency, which are key factors in encouraging donations.",Reasoning
persona_72_Turn4,4,Persuader,Foot in the Door,1,0.36660821164088403,1.0120716426691794,0.36757655412024487,<reasoning> The persuadee has shown interest in the charity but is hesitant to donate immediately.,Reasoning
persona_72_Turn4,4,Persuader,Foot in the Door,2,0.2483006883300006,1.4253072798764117,0.4575116459079886,They expressed that they are not sure if they can contribute right now.,Reasoning
persona_72_Turn4,4,Persuader,Foot in the Door,3,0.4721216692374754,1.5100051589929329,0.44999360355945567,"This hesitation might stem from uncertainty, lack of immediate motivation, or a desire for more reassurance.",Reasoning
persona_72_Turn4,4,Persuader,Foot in the Door,4,0.2971364988092619,1.286306461991864,0.4685004746951446,"A good strategy would be to use the ""Foot in the Door"" technique.",Reasoning
persona_72_Turn4,4,Persuader,Foot in the Door,5,0.3663803010192021,1.2921263720404723,0.4476332715983322,"This involves asking for a small commitment or contribution first, which can increase the likelihood of a larger donation later.",Reasoning
persona_72_Turn4,4,Persuader,Foot in the Door,6,0.6493465651782548,1.3927651451279601,0.48446677364400975,"It's also a gentle way to encourage the persuadee to take the first step towards donating, making them feel more comfortable and less pressured.",Reasoning
persona_72_Turn5,5,Persuader,Credibility Appeal,1,0.2602609383550087,1.4191192426463224,0.3785538695709171,"<reasoning>The persuadee has expressed openness to making a small contribution, indicating they are receptive to the idea of donating.",Reasoning
persona_72_Turn5,5,Persuader,Credibility Appeal,2,0.5186527086311971,1.3353709463018941,0.43959850110556853,"This is a positive sign, as they are considering taking the first step.",Reasoning
persona_72_Turn5,5,Persuader,Credibility Appeal,3,0.4832871114400478,1.3301728653003162,0.3902315979805485,The next logical step is to reinforce the positive impact of their small donation and encourage them to take action.,Reasoning
persona_72_Turn5,5,Persuader,Credibility Appeal,4,0.644643743540839,1.4035384209860482,0.4274802476974216,Using a credibility appeal could help reinforce the legitimacy of the charity and the effectiveness of their contribution.,Reasoning
persona_53_Turn2,2,Persuader,Foot in the Door,1,0.33891358063430294,1.009172619878282,0.4275240333316445,<reasoning>,Reasoning
persona_53_Turn2,2,Persuader,Foot in the Door,2,0.3808660919258581,1.219533728681814,0.4212830667956409,"The Persuadee mentioned they are stressed with work, which indicates they may be feeling overwhelmed or not in the best mindset to make a donation decision.",Reasoning
persona_53_Turn2,2,Persuader,Foot in the Door,3,0.6320334956274491,1.2491000893462911,0.4305736163518814,This could mean they are less receptive to immediate requests or emotional appeals.,Reasoning
persona_53_Turn2,2,Persuader,Foot in the Door,4,0.6790599045072961,1.3935407180754997,0.5359462056202932,"It's important to approach them with empathy and offer a low-pressure, small commitment.",Reasoning
persona_53_Turn2,2,Persuader,Foot in the Door,5,0.45059681645908156,1.345088239955223,0.49546890988171827,"The ""Foot in the Door"" technique is suitable here, as it involves starting with a small, easy request to encourage a positive response.",Reasoning
persona_53_Turn2,2,Persuader,Foot in the Door,6,0.6166729725143822,1.4400407096120886,0.45571495463491063,"This technique is effective because it reduces the psychological barrier to donating, especially when someone is stressed or uncertain.",Reasoning
persona_53_Turn3,3,Persuader,Logical Appeal,1,0.3305037581315792,0.9593716100979506,0.41344485230430633,<reasoning>,Reasoning
persona_53_Turn3,3,Persuader,Logical Appeal,2,0.2710498643704855,0.905959279515524,0.330827360815674,The Persuadee has expressed uncertainty about donating and is asking for more information on how the money is used.,Reasoning
persona_53_Turn3,3,Persuader,Logical Appeal,3,0.26976648925805913,1.0722849177756943,0.3534129229696634,This suggests they are looking for transparency and reassurance about the impact of their donation.,Reasoning
persona_53_Turn3,3,Persuader,Logical Appeal,4,0.6925877386361854,1.4771691878191973,0.4450123976058798,"At this stage, it is crucial to provide clear, logical information that demonstrates how donations are utilized to help children in need.",Reasoning
persona_53_Turn3,3,Persuader,Logical Appeal,5,0.5118893972557582,1.4502207100171376,0.5244569050736491,"This aligns with the Logical Appeal strategy, which aims to build a rational case for the donation by showing the tangible benefits and the effectiveness of the charity's work.",Reasoning
persona_53_Turn4,4,Persuader,Credibility Appeal,1,0.4301314439735987,1.4181368080724663,0.451154859597561,"<reasoning>The persuadee is expressing concern about the transparency and efficiency of the charity, specifically questioning whether the donations will be used for the intended purposes.",Reasoning
persona_53_Turn4,4,Persuader,Credibility Appeal,2,0.5799295015302993,1.3602569295387625,0.48423350753671246,"This shows that the persuadee is cautious and skeptical, likely looking for reassurance and proof of the charity's credibility.",Reasoning
persona_53_Turn4,4,Persuader,Credibility Appeal,3,0.6850035491967392,1.4923339365351307,0.448223571501345,"To build trust, it is essential to address these concerns by providing evidence of the charity’s accountability and transparency.",Reasoning
persona_53_Turn5,5,Persuader,Foot in the Door,1,0.345935521081657,1.0442823221150526,0.438619502282429,<reasoning>,Reasoning
persona_53_Turn5,5,Persuader,Foot in the Door,2,0.2610221523410478,0.6628473073993157,0.2949943216487497,The persuadee has expressed hesitation due to financial concerns.,Reasoning
persona_53_Turn5,5,Persuader,Foot in the Door,3,0.5468514735800873,1.40499721197993,0.49949444167611906,They are looking for reassurance about the affordability of the donation and may be testing the Persuader's commitment to making the donation feel optional or low-pressure.,Reasoning
persona_53_Turn5,5,Persuader,Foot in the Door,4,0.5621704208323428,1.4198225489844336,0.4596063836642354,It is important to respond with empathy and offer flexibility to make the donation feel more accessible and less burdensome.,Reasoning
persona_53_Turn5,5,Persuader,Foot in the Door,5,0.4135689485687405,1.385949519172641,0.4216570862992998,"Using the ""Foot in the Door"" strategy could help by encouraging a small, low-commitment action, which can lead to a larger commitment later.",Reasoning
persona_53_Turn5,5,Persuader,Foot in the Door,6,0.5745022045972177,1.4203343555652042,0.5209806971038857,"Additionally, offering the option to donate a small amount or even a symbolic gesture can reduce the psychological barrier.",Reasoning
persona_53_Turn6,6,Persuader,Personal Story,1,0.5052132323487329,1.533843996348586,0.45180614451503026,"<reasoning>The persuadee is showing hesitation and is still unsure about donating, even though they’ve acknowledged the flexibility of the donation amount.",Reasoning
persona_53_Turn6,6,Persuader,Personal Story,2,0.5658945662382039,1.388548846040123,0.4889961703073732,"They seem to be struggling with the decision-making process, possibly due to uncertainty or a lack of personal connection.",Reasoning
persona_53_Turn6,6,Persuader,Personal Story,3,0.7949598275084968,1.466185919855197,0.5189157318083585,The persuasion needs to move from general appeals to something more personalized or emotionally resonant.,Reasoning
persona_53_Turn6,6,Persuader,Personal Story,4,0.6150846349106514,1.5430814241646371,0.5175179702622507,A personal story could help create an emotional connection and make the donation feel more relevant and impactful to the persuadee’s life.,Reasoning
persona_53_Turn6,6,Persuader,Personal Story,5,0.821452319772375,1.4032903515832036,0.4490816548611698,"The persuadee has not yet donated, and the hesitation suggests they might need a more emotionally compelling reason or a clearer sense of how the donation directly helps someone.",Reasoning
persona_53_Turn6,6,Persuader,Personal Story,6,0.6583138854522336,1.4298705283470412,0.48553777128229225,"Sharing a brief, relatable personal story about a child who has benefited from the charity's work could help shift the conversation toward empathy and personal relevance.",Reasoning
persona_53_Turn6,6,Persuader,Personal Story,7,0.8568213998363946,1.4339426328717026,0.5030002194614533,This could lead to a more impactful and memorable appeal that aligns with their values and emotions.,Reasoning
persona_53_Turn7,7,Persuader,Self Modeling,1,0.3610897935263157,1.1200536843383462,0.4631107330252944,<reasoning>,Reasoning
persona_53_Turn7,7,Persuader,Self Modeling,2,0.5897281086392449,1.3900697093090337,0.40472314209315996,"The persuadee has expressed uncertainty and hesitation, even though they have acknowledged the flexibility of the donation amount.",Reasoning
persona_53_Turn7,7,Persuader,Self Modeling,3,0.5779868141665616,1.3568289745823536,0.4836335145235071,"They are still feeling that it's a big decision, even for a small amount.",Reasoning
persona_53_Turn7,7,Persuader,Self Modeling,4,0.6788064691105806,1.2000430882476203,0.35730009654918815,This suggests they might need more personal connection or a sense of empowerment to feel comfortable with the donation.,Reasoning
persona_53_Turn7,7,Persuader,Self Modeling,5,0.7428407486160861,1.4165898883989,0.5079766391330878,They also need reassurance and a gentle nudge to take action without feeling pressured.,Reasoning
persona_53_Turn8,8,Persuader,Source Related Inquiry,1,0.24825952430295675,1.1377421289162868,0.33598431553104446,"<reasoning>The Persuadee is currently feeling overwhelmed with personal responsibilities and is struggling to focus on anything else, including donating to a charity.",Reasoning
persona_53_Turn8,8,Persuader,Source Related Inquiry,2,0.6060970709525949,1.468301360455944,0.4838420004675805,This indicates a lack of mental bandwidth and emotional readiness to take action.,Reasoning
persona_53_Turn8,8,Persuader,Source Related Inquiry,3,0.4919654313009024,1.4836925687867435,0.48267539314138336,The Persuadee may be experiencing decision fatigue and is looking for reassurance that their time and resources are being used wisely.,Reasoning
persona_53_Turn8,8,Persuader,Source Related Inquiry,4,0.7480008384176104,1.5006235846025335,0.4315096844448146,"They may also be more receptive to a gentle, low-pressure approach that emphasizes the ease of the donation and the small impact they can make.",Reasoning
persona_53_Turn8,8,Persuader,Source Related Inquiry,5,0.6924921997072934,1.3756200099948166,0.4745251467546666,The key is to offer reassurance and make the donation feel like a manageable and meaningful choice rather than a significant burden.,Reasoning
persona_53_Turn8,8,Persuader,Source Related Inquiry,6,0.6959716472135005,1.4797971154167013,0.5734645151640955,"This suggests using the ""Source Related Inquiry"" strategy to further establish trust and reduce hesitation.",Reasoning
persona_53_Turn9,9,Persuader,Source Related Inquiry,1,0.4117657542495151,1.2625464341136872,0.4186977906476857,"<reasoning>The persuadee has expressed uncertainty and a need for more time, indicating they are overwhelmed and not ready to commit.",Reasoning
persona_53_Turn9,9,Persuader,Source Related Inquiry,2,0.676445458168192,1.3865023850259173,0.5608202959720394,They are likely prioritizing their current responsibilities over donating.,Reasoning
persona_53_Turn9,9,Persuader,Source Related Inquiry,3,0.5108281764922795,1.351683622383494,0.4258475053936914,"At this stage, it's best to acknowledge their feelings and offer a gentle, non-pressure approach.",Reasoning
persona_53_Turn9,9,Persuader,Source Related Inquiry,4,0.29304131789684,1.4365709335362884,0.4134254360211995,The goal is to leave the door open for future engagement without pushing them further.,Reasoning
persona_53_Turn9,9,Persuader,Source Related Inquiry,5,0.7105977731471267,1.432151678589612,0.5180959309797063,A source-related inquiry could help validate their concerns and build trust.,Reasoning
persona_53_Turn10,10,Persuader,Foot in the Door,1,0.43707381681289464,1.32063899449241,0.4078449103237669,"<reasoning>At this point in the conversation, the Persuadee has shown interest in the charity and its impact but has not yet made a donation.",Reasoning
persona_53_Turn10,10,Persuader,Foot in the Door,2,0.40588170679513835,1.2441375859181103,0.40317364071757034,They expressed hesitation due to feeling overwhelmed with their own responsibilities and stated they would think about it when things settle down.,Reasoning
persona_53_Turn10,10,Persuader,Foot in the Door,3,0.46976180098463627,1.0429918499194168,0.35910303261620646,This suggests they are open to the idea of donating but need more time and reassurance.,Reasoning
persona_53_Turn10,10,Persuader,Foot in the Door,4,0.6322984842333942,1.3832064614391446,0.5007337391337179,"A good strategy would be to reinforce the idea that even a small contribution can make a difference and encourage them to take a small step toward donating, without pressuring them.",Reasoning
persona_280_Turn2,2,Persuader,Personal Story,1,0.27694765964322215,1.28281193905846,0.39580272941635586,"<reasoning>The conversation has started with a friendly greeting, and the persuadee has responded in a positive and casual manner.",Reasoning
persona_280_Turn2,2,Persuader,Personal Story,2,0.5440253333766347,1.4357268393727634,0.49506875771414793,The persuadee's mention of a recent dive suggests they may have a sense of adventure and openness to new experiences.,Reasoning
persona_280_Turn2,2,Persuader,Personal Story,3,0.4587707087752897,1.324818721408031,0.48622591305865775,"This could be a good opportunity to connect with them on a personal level and use the ""Personal Story"" strategy to build rapport.",Reasoning
persona_280_Turn2,2,Persuader,Personal Story,4,0.5952344199826779,1.5051973317881768,0.4915201556371352,"By sharing a brief, relatable story, the persuader can create a more engaging and empathetic connection, making the charity appeal more impactful.",Reasoning
