Sample_ID,Round,Role,Strategy,Sentence_Index,Mean_Entropy,Max_Entropy,Std_Entropy,Text_Content,Phase
persona_280_Turn2,2,Persuader,Personal Story,5,0.7285588714221087,1.4166721901413895,0.480420453426251,The story should be relevant to the persuadee's interests or experiences to keep the conversation flowing naturally and to build trust.,Reasoning
persona_280_Turn3,3,Persuader,Credibility Appeal,1,0.4058679367535886,1.430696993644975,0.4398742241203046,"<reasoning>The persuadee is showing interest in how donations are used, which is a logical appeal.",Reasoning
persona_280_Turn3,3,Persuader,Credibility Appeal,2,0.40335335724870947,1.2450504449697304,0.4345626743925957,They are likely looking for reassurance that their contribution will be effective and transparent.,Reasoning
persona_280_Turn3,3,Persuader,Credibility Appeal,3,0.46834623093583805,1.280623386238864,0.3811424415087752,This is a good opportunity to build credibility and provide concrete information about how donations are utilized.,Reasoning
persona_280_Turn4,4,Persuader,Donation Information,1,0.3402590852627634,1.4340412089630932,0.41534764199502305,<reasoning>The Persuadee is showing interest in the charity but is seeking more concrete information about how Save the Children measures the success of their programs.,Reasoning
persona_280_Turn4,4,Persuader,Donation Information,2,0.5270186372625514,1.0666531550666782,0.413589092160649,This indicates they are looking for reassurance and proof of impact before making a decision.,Reasoning
persona_280_Turn4,4,Persuader,Donation Information,3,0.5332999729352481,1.4263214248444562,0.4619796285874444,"The next logical step is to provide specific information about how the charity tracks and reports on its achievements, which will help build trust and credibility.",Reasoning
persona_280_Turn5,5,Persuader,Foot in the Door,1,0.3100370689293501,0.9679822044245074,0.39883207594566833,<reasoning>,Reasoning
persona_280_Turn5,5,Persuader,Foot in the Door,2,0.3317730848553965,1.0360088492721529,0.35084285101722,The persuadee has expressed interest in how Save the Children measures success but is still hesitant about donating due to priorities.,Reasoning
persona_280_Turn5,5,Persuader,Foot in the Door,3,0.5825641523392667,1.3287854625742386,0.48506628270451285,This hesitation suggests they value accountability and may need further reassurance about the impact of their donation.,Reasoning
persona_280_Turn5,5,Persuader,Foot in the Door,4,0.37561875555156454,1.2636093894726326,0.4106345429780526,They may also be looking for a personal connection or a reason that aligns with their values or lifestyle.,Reasoning
persona_280_Turn5,5,Persuader,Foot in the Door,5,0.33640134371520986,1.3981050453025086,0.4343893158994672,"At this point, it would be beneficial to use a ""Foot in the Door"" strategy, which involves asking for a small commitment or donation that is easy to agree to, thereby increasing the likelihood of a larger contribution later.",Reasoning
persona_280_Turn6,6,Persuader,Self Modeling,1,0.29258167248482203,0.9495118509402922,0.3093941358445578,"<reasoning>The Persuadee has expressed openness to trying a small donation, indicating a potential willingness to engage further.",Reasoning
persona_280_Turn6,6,Persuader,Self Modeling,2,0.5761749907280269,1.5084575610832756,0.4764623136928949,This is a crucial moment to reinforce the positive impact of even small contributions and to encourage a commitment.,Reasoning
persona_280_Turn6,6,Persuader,Self Modeling,3,0.6138494757358461,1.3872911510091837,0.43925683719404907,"The Persuadee may be seeking reassurance that their contribution will make a tangible difference, and the next step is to solidify their decision by highlighting the positive outcomes that can be achieved through such a small act.",Reasoning
persona_280_Turn7,7,Persuader,Self Modeling,1,0.34238867342014245,1.0844563929708868,0.4435392998429803,<reasoning>,Reasoning
persona_280_Turn7,7,Persuader,Self Modeling,2,0.4962386762135598,1.4145079151556972,0.5413301044710563,The Persuadee has already been convinced to make a small donation after being shown the benefits of even a small contribution.,Reasoning
persona_280_Turn7,7,Persuader,Self Modeling,3,0.4771811018235584,1.478791493692111,0.527624752698326,"The Persuader has already used several strategies like Credibility Appeal, Donation Information, and Foot in the Door to build trust and encourage the action.",Reasoning
persona_280_Turn7,7,Persuader,Self Modeling,4,0.4011736685458136,1.3251578458245155,0.4427839447340158,"At this point, the Persuadee is ready to take the next step and make the donation.",Reasoning
persona_280_Turn7,7,Persuader,Self Modeling,5,0.6042576666237467,1.3130612544289708,0.40575872129569585,"The logical next step is to acknowledge the decision and reinforce the positive impact, which can be done through a simple and encouraging response.",Reasoning
persona_280_Turn8,8,Persuader,Self Modeling,1,0.4163529716783673,1.299067820691159,0.46976119232158986,"<reasoning>The dialogue has progressed positively, with the persuadee showing openness to donating a small amount.",Reasoning
persona_280_Turn8,8,Persuader,Self Modeling,2,0.6416515500150762,1.339124625460974,0.45727442124673207,"They have already agreed to proceed with a donation, which is a clear sign of willingness to engage with the charity.",Reasoning
persona_280_Turn8,8,Persuader,Self Modeling,3,0.4938329386077281,1.2733152120264375,0.4129449908931033,The final step is to reinforce the impact of their contribution and express gratitude to solidify their decision and ensure they feel good about their choice.,Reasoning
persona_280_Turn8,8,Persuader,Self Modeling,4,0.6989859857219428,1.3709875440406494,0.4621569473915422,This stage is crucial for building a positive association with the act of donating and reinforcing the positive impact of their small contribution.,Reasoning
persona_115_Turn2,2,Persuader,Personal Story,1,0.43335793329972433,1.3559945086166567,0.5132380598766532,<response>Have you ever met a child who couldn't afford basic necessities like clean water or food?,Response
persona_115_Turn2,2,Persuader,Personal Story,2,0.36709740160509274,1.5140338207373507,0.4277790996555597,"A few years ago, I met a child in a war zone who shared a single apple with his siblings every day.",Response
persona_115_Turn2,2,Persuader,Personal Story,3,0.4289719501912801,1.333182543813237,0.5020428089759212,"It made me realize how much we take for granted, and I've been trying to help in small ways ever since.",Response
persona_115_Turn2,2,Persuader,Personal Story,4,0.2652351551699864,1.2903316470623607,0.41414318739373446,Would you like to join me in making a difference?,Response
persona_115_Turn2,2,Persuader,Personal Story,5,0.25041322298070473,1.3991201522117847,0.39160123102504507,Just $1 can provide a child with a meal for a day,Response
persona_115_Turn3,3,Persuader,Foot in the Door,1,0.36014336757078114,1.303839105905145,0.4274784303264771,"<response>That's completely understandable, and I completely respect that.",Response
persona_115_Turn3,3,Persuader,Foot in the Door,2,0.3890579113695228,1.4258201074412713,0.47273632227367424,"I'm just reaching out to share that even small donations, like $1 or $2, can have a real impact—like providing a child with a meal for a day.",Response
persona_115_Turn3,3,Persuader,Foot in the Door,3,0.3506064319083103,1.3128823185363179,0.4149514613721305,"If you're open to it, I'd love to ask you to consider a small contribution today.",Response
persona_115_Turn3,3,Persuader,Foot in the Door,4,0.39878072397905145,1.2628114757919509,0.4531413064054972,"It's a small step, but it could make a huge difference.",Response
persona_115_Turn3,3,Persuader,Foot in the Door,5,0.2639920700526375,0.5876287469884609,0.22013814104385632,Would you be open to that,Response
persona_115_Turn4,4,Persuader,Credibility Appeal,1,0.23335053716647625,1.3965219964678788,0.3562672404562624,"<response>Save the Children is a well-established charity based in London, and we are a trusted organization with a proven track record of helping children in need around the world.",Response
persona_115_Turn4,4,Persuader,Credibility Appeal,2,0.22722823704116052,1.2203116446590228,0.3868962499886831,"Your donation will directly support programs that provide clean water, food, education, and healthcare to children in poverty and war zones.",Response
persona_115_Turn4,4,Persuader,Credibility Appeal,3,0.21673269151845628,0.7915550955092061,0.2873035690110015,Would you like to see how your contribution can make a difference,Response
persona_115_Turn5,5,Persuader,Source Related Inquiry,1,0.1436743728825183,1.0743683545485962,0.3103181713101281,<response>Would you like to know more about the specific programs or the impact of donations?,Response
persona_115_Turn5,5,Persuader,Source Related Inquiry,2,0.22068048091926867,0.6853952832932325,0.2600607020612078,I can share how your contribution can directly help children in need around the world.,Response
persona_115_Turn6,6,Persuader,Donation Information,1,0.2990279195031275,1.4280096214601123,0.3657158490855089,"<response>For instance, a $10 donation can provide a child with a month’s supply of clean water, while a $25 donation can cover a child's school supplies for a year.",Response
persona_115_Turn6,6,Persuader,Donation Information,2,0.32750381721165367,1.223984228223265,0.44324321172327874,"These contributions directly support children in need, ensuring they have access to essential resources.",Response
persona_115_Turn6,6,Persuader,Donation Information,3,0.28894008814175515,1.3714354350978497,0.42784306907936615,Would you like to make a donation today and see how your contribution can change a child's life,Response
persona_115_Turn7,7,Persuader,Personal Story,1,0.274836078133054,1.2656116417873988,0.3373804648068671,<response>Let me share a story about a girl named Amina who lives in a war-torn region.,Response
persona_115_Turn7,7,Persuader,Personal Story,2,0.3076216761501628,1.0833573670402121,0.3700565359394501,"With your help, she was able to attend school and now she's helping her community.",Response
persona_115_Turn7,7,Persuader,Personal Story,3,0.3917209196744203,1.2567945636635904,0.47059512277079074,Even a small donation can be the key to a brighter future for a child like Amina.,Response
persona_115_Turn7,7,Persuader,Personal Story,4,0.16064876816417784,0.6274869741298253,0.2563931442875369,Would you like to be part of that story,Response
persona_115_Turn8,8,Persuader,Personal Related Inquiry,1,0.3023269450097613,1.3877107071653725,0.5019792123700408,<response> I completely understand that helping animals is important to you!,Response
persona_115_Turn8,8,Persuader,Personal Related Inquiry,2,0.34193908006545287,1.4349085708177998,0.5180233946794219,Would you be open to the idea of supporting both animals and children in need?,Response
persona_115_Turn8,8,Persuader,Personal Related Inquiry,3,0.4585424040033557,1.2772113683845696,0.40204180253202687,Your donation could help provide food and clean water to children while also supporting your work with animals in meaningful ways.,Response
persona_115_Turn8,8,Persuader,Personal Related Inquiry,4,0.2196461941149443,1.2269633919128617,0.34267258943002127,It’s a way to make an impact in two areas you care about.,Response
persona_115_Turn9,9,Persuader,Personal Related Inquiry,1,0.4373176743806587,1.237601185116052,0.4567694170047061,<response>It’s great that you care deeply about animals!,Response
persona_115_Turn9,9,Persuader,Personal Related Inquiry,2,0.3183217270186147,1.3502332343398549,0.41176480681383276,I wonder if you'd be open to supporting both causes—your work with animals and helping children in need?,Response
persona_115_Turn9,9,Persuader,Personal Related Inquiry,3,0.21504480924377162,0.9852615824769465,0.33339358559308097,Your donation could help provide food and clean water to children while also supporting your efforts in meaningful ways.,Response
persona_115_Turn9,9,Persuader,Personal Related Inquiry,4,0.1479382459478243,0.5822031402222432,0.20648101792635692,It's a way to make a difference in two areas you care about.,Response
persona_115_Turn9,9,Persuader,Personal Related Inquiry,5,0.5614371697635077,0.9957307300778628,0.3609677863355117,Would that interest you,Response
persona_115_Turn10,10,Persuader,Task Related Inquiry,1,0.19477262072027945,1.1419884075931859,0.3597670312524449,<response>I completely respect your dedication to animal welfare!,Response
persona_115_Turn10,10,Persuader,Task Related Inquiry,2,0.3105418784171482,1.3368518821617354,0.4271602359015964,Would you be open to the idea of supporting both causes in a way that aligns with your current priorities?,Response
persona_115_Turn10,10,Persuader,Task Related Inquiry,3,0.42765508017739207,1.3475988715880225,0.47901340827976574,"For instance, your support could help provide food and clean water to children while also contributing to animal welfare efforts.",Response
persona_115_Turn10,10,Persuader,Task Related Inquiry,4,0.20805125982882589,0.9414333958800628,0.35392475892894687,It's a way to make an impact in both areas you care about.,Response
persona_115_Turn10,10,Persuader,Task Related Inquiry,5,0.3469577432482868,0.7583452277467717,0.2700439472478133,Would that interest you,Response
persona_72_Turn2,2,Persuader,Logical Appeal,1,0.18225762521642747,0.6628473073993157,0.2672525868203646,<response>It's great to hear you had a peaceful morning.,Response
persona_72_Turn2,2,Persuader,Logical Appeal,2,0.12802458024777805,1.280623386238864,0.30728439493701687,"Did you know that small donations, like just $1 or $2, can make a huge difference in the lives of children in need around the world?",Response
persona_72_Turn2,2,Persuader,Logical Appeal,3,0.30227562860914337,1.2319851681645182,0.3606664526882541,"Save the Children works tirelessly to help children in developing countries and war zones, and your support can be a lifeline for those who need it most",Response
persona_72_Turn3,3,Persuader,Donation Information,1,0.20757207179979312,1.3819652899519645,0.3842891705435456,"<response>Save the Children uses donations to provide life-saving support such as food, clean water, medical care, and education to children in need.",Response
persona_72_Turn3,3,Persuader,Donation Information,2,0.3227474519199224,1.0173572230671475,0.3569139949690613,"Every dollar helps ensure that children can grow up in a safe and healthy environment, giving them the chance to build a brighter future.",Response
persona_72_Turn3,3,Persuader,Donation Information,3,0.28870798737320436,0.9015331630485803,0.34107773627508897,Would you like to contribute today and make a difference in a child's life,Response
persona_72_Turn4,4,Persuader,Foot in the Door,1,0.48075665173788773,1.266818171014697,0.5073791760049285,<response>That's completely understandable.,Response
persona_72_Turn4,4,Persuader,Foot in the Door,2,0.2504597847691783,1.1930214742542358,0.37677246883724014,"Maybe you could start with a small contribution, like $1 or $2, to see how it feels and make a difference in a child's life.",Response
persona_72_Turn4,4,Persuader,Foot in the Door,3,0.5041472036445657,1.2031643453940268,0.4244880729929931,It's a simple way to begin and can inspire you to give more later.,Response
persona_72_Turn4,4,Persuader,Foot in the Door,4,0.17211372346481646,0.6628473073993157,0.2338162300331617,Would you be open to trying that,Response
persona_72_Turn5,5,Persuader,Credibility Appeal,1,0.11565939302589942,1.0920857280566343,0.2716353736449201,<response>Save the Children is a well-established charity with a proven track record of helping children in need around the world.,Response
persona_72_Turn5,5,Persuader,Credibility Appeal,2,0.2864359516710495,0.8626979359051349,0.28541895047305815,Your small contribution will be used efficiently and transparently to make a real difference.,Response
persona_72_Turn5,5,Persuader,Credibility Appeal,3,0.11458338276462447,0.4750515844777051,0.17556516149665446,Would you like to proceed with your donation now,Response
persona_53_Turn2,2,Persuader,Foot in the Door,1,0.2580245008301886,1.013534919322305,0.38079911561690405,<response>I completely understand that work can be stressful.,Response
persona_53_Turn2,2,Persuader,Foot in the Door,2,0.2428140498366674,1.1716321058291284,0.3579571217770126,"It’s easy to feel overwhelmed, but even a small donation of just $1 or $2 can make a real difference.",Response
persona_53_Turn2,2,Persuader,Foot in the Door,3,0.23006416217882103,1.1909176065348859,0.35906811039110703,Would you be open to giving a little something today to help children in need?,Response
persona_53_Turn2,2,Persuader,Foot in the Door,4,0.31990041224993787,1.3935783046362018,0.41930558759386494,"It's a small step, but it can have a big impact",Response
persona_53_Turn3,3,Persuader,Logical Appeal,1,0.2522931549695705,1.009172619878282,0.4369845628091445,<response>,Response
persona_53_Turn3,3,Persuader,Logical Appeal,2,0.3174116665332934,1.2502312028804217,0.35533932695039827,"Every dollar donated to Save the Children is used directly to support programs that provide food, education, healthcare, and safety for children in need.",Response
persona_53_Turn3,3,Persuader,Logical Appeal,3,0.2796332620663926,1.3169103834613003,0.43736774816990026,"For example, $1 can provide a child with a day of nutritious meals, while $2 can help cover the cost of a school supply.",Response
persona_53_Turn3,3,Persuader,Logical Appeal,4,0.39582103016660586,1.3003325233948932,0.3976195544890634,This ensures your donation has a clear and measurable impact on the lives of children in desperate situations.,Response
persona_53_Turn4,4,Persuader,Credibility Appeal,1,0.27360663251713685,1.2966102253863556,0.3826746027873296,<response>Save the Children is a well-established charity with over 100 years of experience and is rated as one of the most transparent charities by independent watchdog organizations.,Response
persona_53_Turn4,4,Persuader,Credibility Appeal,2,0.32630773000019325,0.7744090768201646,0.25058986228951,We are committed to ensuring that every dollar donated is used directly for the programs that help children in need.,Response
persona_53_Turn4,4,Persuader,Credibility Appeal,3,0.46055370948367097,1.2263865097818847,0.45469708255548114,Would you like to know more about our financial transparency or our impact reports,Response
persona_53_Turn5,5,Persuader,Foot in the Door,1,0.22306365351002239,0.8923894990865971,0.29465976720767373,"<response>That’s totally okay—donating even a small amount like $1 or $2 is a great start, and it’s completely up to you.",Response
persona_53_Turn5,5,Persuader,Foot in the Door,2,0.3532579901686701,0.9929534606260321,0.34653043506447856,"You can choose what feels right for your budget, and every little bit helps.",Response
persona_53_Turn5,5,Persuader,Foot in the Door,3,0.10552140134687783,0.8123089360388241,0.2377230960443804,"Would you like to contribute something today, even if it’s just a small amount?",Response
persona_53_Turn5,5,Persuader,Foot in the Door,4,0.20070561064380443,0.9422691739507916,0.30634775726632213,It’s a simple step that can make a big difference for a child in need,Response
persona_53_Turn6,6,Persuader,Personal Story,1,0.2492722025030393,1.1586448057039598,0.3873023105765055,<response>Have you ever wondered how a small donation could change a child's life?,Response
persona_53_Turn6,6,Persuader,Personal Story,2,0.481402951415715,1.188535543879627,0.4345318851633229,"Just last month, a child named Amina in Kenya received a school uniform and books because of a $2 donation.",Response
persona_53_Turn6,6,Persuader,Personal Story,3,0.41406824628948874,1.444333419329922,0.5439848519555105,She’s now attending school regularly and dreaming of becoming a teacher.,Response
persona_53_Turn6,6,Persuader,Personal Story,4,0.24568133358696698,1.381755734756798,0.40271644999270656,Imagine being able to help a child like Amina—would you like to be part of that story today,Response
persona_53_Turn7,7,Persuader,Self Modeling,1,0.3511755250223595,1.2399361281908772,0.41117227332393036,<response>Imagine how good it would feel to know you’ve made a small but meaningful difference in a child’s life—like helping Amina in Kenya.,Response
persona_53_Turn7,7,Persuader,Self Modeling,2,0.3853221412445798,1.1732092613418348,0.36363884509119665,Even a small donation can be the start of something bigger.,Response
persona_53_Turn7,7,Persuader,Self Modeling,3,0.1513756832614207,0.863525484520232,0.27761266889941516,"Would you like to take that step today, just to see how it feels?",Response
persona_53_Turn7,7,Persuader,Self Modeling,4,0.4512252028673476,1.4380212531515577,0.4469033388921416,It’s a simple choice that can bring you peace knowing you’ve helped a child dream bigger.,Response
persona_53_Turn8,8,Persuader,Source Related Inquiry,1,0.41031581002054507,1.3415334465492634,0.4942427308723116,<response>That’s completely understandable—it’s easy to feel overwhelmed with everything on your plate.,Response
persona_53_Turn8,8,Persuader,Source Related Inquiry,2,0.44677620261143663,1.468528186938757,0.49695159183880233,"But I wanted to share that Save the Children has been trusted by millions of people worldwide for over a century, and we're committed to making sure your donation is used exactly as intended.",Response
persona_53_Turn8,8,Persuader,Source Related Inquiry,3,0.36513761062622785,1.2294570747763411,0.4188413262521615,Would you like to see how your contribution could be used in a specific way that aligns with your values?,Response
persona_53_Turn8,8,Persuader,Source Related Inquiry,4,0.5506992041225306,1.1698038808567859,0.329315962579009,It’s a simple way to feel confident in your choice.,Response
persona_53_Turn8,8,Persuader,Source Related Inquiry,5,1.842068074395235e-18,1.842068074395235e-18,0.0,<|im_end|>,Response
persona_53_Turn9,9,Persuader,Source Related Inquiry,1,0.3368455083960615,1.0445462023265581,0.31828397103494543,<response>That’s completely understandable—life can get really busy.,Response
persona_53_Turn9,9,Persuader,Source Related Inquiry,2,0.1922923406022185,1.032144911668615,0.31382722076788355,"If you ever feel ready to explore ways to help, I’d be happy to share more about how your contribution could make a difference.",Response
persona_53_Turn9,9,Persuader,Source Related Inquiry,3,0.387556495197451,1.506498326942362,0.4285697391598298,"You're not alone in this, and I'm here if you need support or more information.",Response
persona_53_Turn9,9,Persuader,Source Related Inquiry,4,0.23104906018664842,0.6931471805599453,0.32675271448951576,Take care!,Response
persona_53_Turn10,10,Persuader,Foot in the Door,1,0.3108790496600654,1.0780996569060295,0.3678677694140196,"<response>That’s perfectly fine—when you’re ready, even a small contribution can be the start of something meaningful.",Response
persona_53_Turn10,10,Persuader,Foot in the Door,2,0.36711231888967677,1.0913221098446657,0.419568390808228,You can always reach out later if you'd like to explore how you can help.,Response
persona_53_Turn10,10,Persuader,Foot in the Door,3,0.04131016076931125,0.22720588423121188,0.08763208443565942,"Take care, and I hope things settle down soon!",Response
persona_280_Turn2,2,Persuader,Personal Story,1,0.2251626061165249,0.9422691739507916,0.32482166454404005,<response>That’s amazing!,Response
persona_280_Turn2,2,Persuader,Personal Story,2,0.5404119683297478,1.3649820669426622,0.48873048863236157,I just got back from a hiking trip too—both of us are always on the move!,Response
persona_280_Turn2,2,Persuader,Personal Story,3,0.28223701980164895,1.0072955590827886,0.3206469433777173,I remember reading about a child in a war zone who was given a chance to go to school because of a small donation.,Response
persona_280_Turn2,2,Persuader,Personal Story,4,0.4634411447728773,1.2549739597061411,0.451700553962896,It reminded me how powerful even a little help can be.,Response
persona_280_Turn2,2,Persuader,Personal Story,5,0.36194497337779397,1.2252325237960762,0.38434440020813243,"Have you ever thought about how your adventures could inspire others, like helping a child get an education",Response
persona_280_Turn3,3,Persuader,Credibility Appeal,1,0.14229917377581416,1.1698038808567859,0.2832298145547952,<response>Save the Children is a well-established charity with a strong track record of transparency and impact.,Response
persona_280_Turn3,3,Persuader,Credibility Appeal,2,0.30757810038250627,0.9585545944429159,0.3421378846121023,"Every dollar donated goes directly toward programs that provide education, health care, and protection for children in need—so you can be confident your contribution makes a real difference",Response
persona_280_Turn4,4,Persuader,Donation Information,1,0.3369794208114789,1.4421691705371886,0.4673603439228428,"<response>Save the Children uses measurable outcomes to track success, such as the number of children who gain access to education, improved health outcomes, and increased safety in communities.",Response
persona_280_Turn4,4,Persuader,Donation Information,2,0.33050253224077636,1.1681987340515567,0.396452339667894,"They regularly publish detailed reports and updates, so you can see exactly how your donation helps transform lives.",Response
persona_280_Turn4,4,Persuader,Donation Information,3,0.23038808183378068,1.0591721903254898,0.3399958500253376,Would you like to see some of these reports or learn more about a specific program,Response
persona_280_Turn5,5,Persuader,Foot in the Door,1,0.22571270463479784,0.7915550955092061,0.28998294078511877,"<response>What if we start with a small contribution, like $1 or $2?",Response
