Sample_ID,Round,Role,Strategy,Sentence_Index,Mean_Entropy,Max_Entropy,Std_Entropy,Text_Content,Phase
persona_280_Turn5,5,Persuader,Foot in the Door,2,0.29757275797518906,1.1974298638180623,0.38109774078430053,"It’s a simple way to show your support, and it can make a real difference in a child’s life.",Response
persona_280_Turn5,5,Persuader,Foot in the Door,3,0.4719152767179848,1.2779758919032511,0.46030297757728417,Would you be open to giving that small amount today?,Response
persona_280_Turn5,5,Persuader,Foot in the Door,4,0.2677439071256457,1.1389512050349007,0.31979284525381485,"It’s a great way to begin, and I’m sure you’ll feel good about it",Response
persona_280_Turn6,6,Persuader,Self Modeling,1,0.2852785822273833,1.1907941637051709,0.4261594386049698,<response>That’s wonderful to hear!,Response
persona_280_Turn6,6,Persuader,Self Modeling,2,0.3453325449964537,1.4304724812550755,0.4880813446472026,"Even a small contribution like $1 or $2 can provide a child with a meal, a notebook, or a chance to learn something new—every little bit helps!",Response
persona_280_Turn6,6,Persuader,Self Modeling,3,0.27007471524208027,1.1580370420490878,0.3542771221818058,I’m sure you’ll feel great knowing you’ve made a difference.,Response
persona_280_Turn6,6,Persuader,Self Modeling,4,0.22816513455434373,1.0481303814341705,0.35542461915467627,Would you like to proceed with your donation now,Response
persona_280_Turn7,7,Persuader,Self Modeling,1,0.12300678321276592,0.4331585190810524,0.16000731744066723,<response>That's fantastic!,Response
persona_280_Turn7,7,Persuader,Self Modeling,2,0.1738683567976981,0.9753278540191775,0.26281062531957844,Your small contribution will make a real difference in a child's life—thank you for helping to create a brighter future!,Response
persona_280_Turn8,8,Persuader,Self Modeling,1,0.14563857024912616,0.6274869741298253,0.23872172586236984,<response>That's fantastic!,Response
persona_280_Turn8,8,Persuader,Self Modeling,2,1.842068074395235e-18,1.842068074395235e-18,0.0,Your small contribution will make a real difference in a child's life—thank you for helping to create a brighter future!,Response
